{
  "content_sha256": "fd09d37aa92f23a1f6df24a7526dbc8c2cdae831915124298b2466bbf0fa4cd8",
  "evidence_class": "factory-run",
  "experience_id": "experience:48c42bfeb93924deee16786e",
  "experience_type": "lightyear-verified-semantic-experience",
  "graph_binding": {
    "evidence_pack_sha256": "ed0f2387aed68ef6d03eab3fb5de8a265feda68c93b35d1d182afce8ff0ec248",
    "graph_content_sha256": "6c999445e3530cff73e5cb18832e101f6f9268fe433e19a3c13cbe2396ab796a"
  },
  "keywords": [
    "attempt",
    "behavior",
    "bound",
    "bounded",
    "builder",
    "cobol-compatible",
    "gates.",
    "intcalc",
    "path",
    "private",
    "proposed",
    "prove",
    "reference",
    "regression",
    "repair",
    "restore",
    "rounding-mode",
    "source-faithful",
    "toward",
    "truncation",
    "writable",
    "zero."
  ],
  "knowledge": {
    "edit_fingerprints": [
      {
        "find_sha256": "d650f51dce6b316584aa17e743622f836ee787d9610cbdceae60dda03287f25c",
        "path": "factory/benchmarks/intcalc_candidate.py",
        "rationale": "Restore COBOL-compatible truncation toward zero.",
        "replace_sha256": "449fe2ed587fee90cc9930592d7e958bbad0a27ae50d6588568465bcfd23658d"
      }
    ],
    "edit_templates": [
      {
        "find": "ROUNDING = \"half-up\"",
        "find_sha256": "d650f51dce6b316584aa17e743622f836ee787d9610cbdceae60dda03287f25c",
        "path": "factory/benchmarks/intcalc_candidate.py",
        "rationale": "Restore COBOL-compatible truncation toward zero.",
        "replace": "ROUNDING = \"down\"",
        "replace_sha256": "449fe2ed587fee90cc9930592d7e958bbad0a27ae50d6588568465bcfd23658d"
      }
    ],
    "lessons": [
      "Restore source-faithful INTCALC behavior and prove it with private gates.",
      "Reference builder proposed 1 bounded repair(s) on attempt 1.",
      "Restore COBOL-compatible truncation toward zero."
    ],
    "summary": "Bound Repair INTCALC rounding-mode regression to 1 writable path(s)."
  },
  "limitations": [
    "Memory is derived from controller-observed artifacts and does not replace source evidence.",
    "A verified local gate does not prove z/OS equivalence."
  ],
  "outcome": {
    "attempts": 1,
    "changed_paths": [
      "factory/benchmarks/intcalc_candidate.py"
    ],
    "class": "verified_success",
    "gates": [
      {
        "id": "private-intcalc-policy",
        "output_sha256": "6798a983342b663fad63fce975ac2dfc8ea52fb7763551eb7402d2e46715e0f7",
        "status": "passed"
      }
    ],
    "status": "passed"
  },
  "privacy": {
    "audience": "implementer",
    "executable_negative_edits_included": false,
    "sealed_holdout_content_included": false,
    "verifier_private_artifacts_excluded": true
  },
  "run_binding": {
    "final_snapshot_sha256": "70bb0eaceff6f019f3f1bed350440d9b7875d9ca95acce9f78249f4bfa152463",
    "initial_snapshot_sha256": "015e91f5c9d4dac3ed24102d321c1427fd657600b994fb503d52fe1e3827565c",
    "ledger_head_sha256": "186c81cdc7ea16b28a0b47577c6e5f6dfc4709ad7b315111ca97039699cef861",
    "run_id": "memory-demo-verified-repair",
    "work_order_id": "benchmark:intcalc:rounding-mode",
    "work_order_sha256": "5d69202e3cd8c80337acdb9f97940f216b5edae25af76c58a793052a6e1ebb51"
  },
  "schema_version": "1.0",
  "scope": {
    "evidence_capsule_ids": [
      "capsule:00499794e29839da11701d13",
      "capsule:00d173112582b1d0d1b9256a",
      "capsule:04912d3599317c8ee29cd741",
      "capsule:050be894b432055cfd868396",
      "capsule:0619668eabd4c0d8d19cd69a",
      "capsule:0e55a29c41b127d2684e4a75",
      "capsule:0f74030cbf9521668ea42bf7",
      "capsule:115a8c8c9ca2af9894fee5c9"
    ],
    "graph_node_ids": [
      "workload:carddemo-intcalc"
    ],
    "paths": [
      "factory/benchmarks/intcalc_candidate.py"
    ]
  },
  "state": "active"
}
